{
  "source_id": "2026-03-18-sales-friction-notes",
  "company_id": "guide-demo-lab",
  "source_kind": "sales_notes",
  "origin": "user",
  "title": "Sales friction notes",
  "uri_or_path": "",
  "status": "processed",
  "source_origin": "user",
  "source_refs": [
    "2026-03-18-sales-friction-notes"
  ],
  "evidence_refs": [],
  "summary": "Prospects worry about vague promises. They ask who this is for, what deliverables they will receive and how the service avoids sounding generic.",
  "body": "Prospects worry about vague promises. They ask who this is for, what deliverables they will receive and how the service avoids sounding generic.",
  "tags": [],
  "created_at": "2026-03-18T15:03:03",
  "updated_at": "2026-03-18T15:03:03"
}
