{
  "source_id": "2026-03-18-ws-capital-homepage",
  "company_id": "wsc-lat",
  "source_kind": "website",
  "origin": "public_web",
  "title": "WS Capital | AI Lab & Venture Capital Hybrid",
  "uri_or_path": "https://wsc.lat/",
  "status": "processed",
  "source_origin": "public_web",
  "source_refs": [
    "2026-03-18-ws-capital-homepage"
  ],
  "evidence_refs": [],
  "summary": "WS Capital | AI Lab & Venture Capital Hybrid WS_BOOT_SEQUENCE Mounting Intelligence Units... \u25c8 WS_STATION Manifesto Infrastructure AI Lab Intelligence Research Archives \u25cf Online 00:00:00 EN Vision.Manifesto INVESTING IN PEOPLE. BUILDING INFRASTRUCTURE WITH COLD PRECISION. The AI",
  "body": "WS Capital | AI Lab & Venture Capital Hybrid WS_BOOT_SEQUENCE Mounting Intelligence Units... \u25c8 WS_STATION Manifesto Infrastructure AI Lab Intelligence Research Archives \u25cf Online 00:00:00 EN Vision.Manifesto INVESTING IN PEOPLE. BUILDING INFRASTRUCTURE WITH COLD PRECISION. The AI",
  "tags": [
    "public-site",
    "homepage",
    "manifesto"
  ],
  "created_at": "2026-03-18T20:11:02",
  "updated_at": "2026-03-18T20:11:02"
}
