{
  "source_id": "2026-03-18-homepage-notes",
  "company_id": "guide-demo-lab",
  "source_kind": "website_note",
  "origin": "user",
  "title": "Homepage notes",
  "uri_or_path": "",
  "status": "processed",
  "source_origin": "user",
  "source_refs": [
    "2026-03-18-homepage-notes"
  ],
  "evidence_refs": [],
  "summary": "Founders say most agencies sound polished but never explain what actually gets done. Buyers want clarity before hype and want to see proof of process.",
  "body": "Founders say most agencies sound polished but never explain what actually gets done. Buyers want clarity before hype and want to see proof of process.",
  "tags": [],
  "created_at": "2026-03-18T15:03:03",
  "updated_at": "2026-03-18T15:03:03"
}
