{
  "source_id": "2026-03-18-tour360-recorridos",
  "company_id": "public-case-real-estate-studio",
  "source_kind": "public_reference",
  "origin": "public_web",
  "title": "Tour 360 recorridos inmobiliarios",
  "uri_or_path": "https://360tour.com.mx/recorridos-inmobiliarios/",
  "status": "normalized",
  "source_origin": "public_web",
  "source_refs": [
    "2026-03-18-tour360-recorridos"
  ],
  "evidence_refs": [
    "2026-03-18-tour-360-filtra-visitas"
  ],
  "summary": "Referencia publica de categoria. Tour 360 argumenta que los recorridos virtuales reducen visitas presenciales improductivas, permiten gestionar mas propiedades y mejoran la eficiencia comercial al mostrar primero solo a prospectos con interes real.",
  "body": "Referencia publica de categoria. Tour 360 argumenta que los recorridos virtuales reducen visitas presenciales improductivas, permiten gestionar mas propiedades y mejoran la eficiencia comercial al mostrar primero solo a prospectos con interes real.",
  "tags": [
    "categoria",
    "eficiencia-comercial",
    "tour-360"
  ],
  "created_at": "2026-03-18T17:07:10",
  "updated_at": "2026-03-18T17:07:10"
}
