{
  "source_id": "2026-03-18-shot360-articulo",
  "company_id": "public-case-real-estate-studio",
  "source_kind": "public_reference",
  "origin": "public_web",
  "title": "Shot 360 articulo sobre asesores exitosos",
  "uri_or_path": "https://shot360.com.mx/el-secreto-de-los-asesores-mas-exitosos",
  "status": "normalized",
  "source_origin": "public_web",
  "source_refs": [
    "2026-03-18-shot360-articulo"
  ],
  "evidence_refs": [
    "2026-03-18-el-material-debe-servir-para-whatsapp"
  ],
  "summary": "Referencia publica de categoria. Shot 360 se posiciona para asesores y desarrolladores con fotografia profesional, recorridos virtuales 360 y video inmobiliario de alto impacto. El subtexto es que la calidad del material comercial influye en captacion, percepcion y velocidad de v",
  "body": "Referencia publica de categoria. Shot 360 se posiciona para asesores y desarrolladores con fotografia profesional, recorridos virtuales 360 y video inmobiliario de alto impacto. El subtexto es que la calidad del material comercial influye en captacion, percepcion y velocidad de venta.",
  "tags": [
    "categoria",
    "foto",
    "video"
  ],
  "created_at": "2026-03-18T17:07:10",
  "updated_at": "2026-03-18T17:07:10"
}
