{
  "source_id": "2026-03-18-buyer-objections-board",
  "company_id": "public-case-real-estate-studio",
  "source_kind": "buyer_notes",
  "origin": "composite_case",
  "title": "Tablero de objeciones de comprador",
  "uri_or_path": "",
  "status": "normalized",
  "source_origin": "composite_case",
  "source_refs": [
    "2026-03-18-buyer-objections-board"
  ],
  "evidence_refs": [
    "2026-03-18-buyer-quiere-paquete-unificado",
    "2026-03-18-objecion-sobre-alcance-y-rondas"
  ],
  "summary": "Objeciones sinteticas de directores comerciales y de mercadotecnia de desarrolladoras residenciales boutique. Les preocupa pagar por material visual que no se actualice rapido, que no conecte con ventas o que se vuelva decorativo sin ayudar a filtrar prospectos.",
  "body": "Objeciones sinteticas de directores comerciales y de mercadotecnia de desarrolladoras residenciales boutique. Les preocupa pagar por material visual que no se actualice rapido, que no conecte con ventas o que se vuelva decorativo sin ayudar a filtrar prospectos.",
  "tags": [
    "objeciones",
    "comprador",
    "trust"
  ],
  "created_at": "2026-03-18T17:07:10",
  "updated_at": "2026-03-18T17:07:10"
}
